[
  {
    "id": "main-quests",
    "label": "Main Wishes",
    "desc": "Complete all main storyline quests in Pharloom.",
    "contrib": 0,
    "items": [
      {
        "id": "citadel-seeker",
        "label": "The Great Citadel",
        "type": "quest",
        "flag": "Citadel Seeker",
        "icon": "assets/quest/Seek_Quest_Icon.png",
        "description": "Ascend through the lands of Pharloom and reach the Citadel at the kingdom's peak. Reach the Citadel. ",
        "link": "https://hollowknight.wiki/w/Acts#Act_1:_Pharloom"
      },
      {
        "id": "threadspun-town",
        "label": "The Threadspun Town",
        "type": "quest",
        "flag": "The Threadspun Town",
        "icon": "assets/quest/Save_Quest_Icon.png",
        "description": "Break the silken curse ensnaring the town of Bellhart. Defeat Widow to free the town of Bellhart. ",
        "link": "https://hollowknight.wiki/w/Acts#Act_1:_Pharloom"
      },
      {
        "id": "grand-gate",
        "label": "Grand Gate",
        "type": "quest",
        "flag": "Grand Gate Bellshrines",
        "icon": "assets/quest/Gate_Quest_Icon.png",
        "description": "Awaken the old bells throughout the lands. Journey to the five Bellshrines throughout lower Pharloom and ring them to unlock the Grand Gate",
        "link": "https://hollowknight.wiki/w/Acts#Act_1:_Pharloom",
        "missable": true
      },
      {
        "id": "silent-halls",
        "label": "Silent Halls",
        "type": "quest",
        "flag": "Citadel Investigate",
        "icon": "assets/quest/Seek_Quest_Icon.png",
        "description": "Venture inside the Citadel and confront the veiled bugs. Confront Lace within the Choral Chambers.",
        "link": "https://hollowknight.wiki/w/Acts#Act_2:_Citadel_of_Song"
      },
      {
        "id": "pharlooms-crown-1",
        "label": "Pharloom’s Crown #1",
        "type": "quest",
        "flag": "Citadel Ascent",
        "icon": "assets/quest/Seek_Quest_Icon.png",
        "description": "Scale the Citadel and confront the one who haunts the lands of Pharloom. ",
        "link": "https://hollowknight.wiki/w/Acts#Act_2:_Citadel_of_Song"
      },
      {
        "id": "pharlooms-crown-2",
        "label": "Pharloom’s Crown #2",
        "type": "quest",
        "flag": "Citadel Ascent Melodies",
        "icon": "assets/quest/Seek_Quest_Icon.png",
        "description": "Learn the threefold melody and open the path to the Citadel’s crest.",
        "link": "https://hollowknight.wiki/w/Acts#Act_2:_Citadel_of_Song"
      },
      {
        "id": "pharlooms-crown-3",
        "label": "Pharloom’s Crown #3",
        "type": "quest",
        "flag": "Citadel Ascent Lift",
        "icon": "assets/quest/Seek_Quest_Icon.png",
        "description": "Rise above the Citadel and confront the one who haunts the land of Pharloom.",
        "link": "https://hollowknight.wiki/w/Acts#Act_2:_Citadel_of_Song"
      },
      {
        "id": "pale-monarch",
        "label": "Pale Monarch",
        "category": "Boss",
        "flag": "Silk Boss",
        "type": "journal",
        "subtype": "kills",
        "required": 1,
        "icon": "assets/quest/Seek_Quest_Icon.png",
        "description": "Confront the one who haunts the lands of Pharloom. Defeat Grand Mother Silk.",
        "link": "https://hollowknight.wiki/w/Acts#Act_2:_Citadel_of_Song"
      },
      {
        "id": "soul-snare",
        "label": "Soul Snare",
        "type": "quest",
        "flag": "Silk Defeat Snare",
        "icon": "assets/quest/Snare_Quest_Icon.png",
        "description": "Scale the Citadel and ensnare its monarch in a deadly trap. Defeat Grand Mother Silk with the Needolin.",
        "link": "https://hollowknight.wiki/w/Acts#Act_2:_Citadel_of_Song"
      },
      {
        "id": "after-the-fall",
        "label": "After the Fall",
        "type": "quest",
        "flag": "Black Thread Pt0",
        "icon": "assets/quest/Fall_Quest_Icon.png",
        "description": "Discover the fate of Pharloom. Escape the Cradle.",
        "link": "https://hollowknight.wiki/w/Acts#Act_3:_Abyss"
      },
      {
        "id": "awaiting-the-end",
        "label": "Awaiting the End",
        "type": "quest",
        "flag": "Black Thread Pt1 Shamans",
        "icon": "assets/quest/Fall_Quest_Icon.png",
        "description": "Confront the caretaker and his family in the Ruined Chapel beside Bone Bottom.",
        "link": "https://hollowknight.wiki/w/Acts#Act_3:_Abyss"
      },
      {
        "id": "beast-in-the-bells",
        "label": "Beast in the Bells",
        "type": "quest",
        "flag": "Bellbeast Rescue",
        "icon": "assets/quest/Beast_Quest_Icon.png",
        "description": "Descend into the Bellway and defeat the hostile creature within.",
        "link": "https://hollowknight.wiki/w/Acts#Act_3:_Abyss"
      },
      {
        "id": "the-dark-below-1",
        "label": "The Dark Below #1",
        "type": "quest",
        "flag": "Diving Bell Pt1 Inspect",
        "icon": "assets/quest/Fall_Quest_Icon.png",
        "description": "In Deep Docks, find a way to descend beneath Pharloom.",
        "link": "https://hollowknight.wiki/w/Acts#Act_3:_Abyss"
      },
      {
        "id": "the-dark-below-2",
        "label": "The Dark Below #2",
        "type": "quest",
        "flag": "Diving Bell Pt2 Ballow",
        "icon": "assets/quest/Fall_Quest_Icon.png",
        "description": "Find aid in the Deep Docks to access its diving bell and descend beneath Pharloom.",
        "link": "https://hollowknight.wiki/w/Acts#Act_3:_Abyss"
      },
      {
        "id": "the-dark-below-3",
        "label": "The Dark Below #3",
        "type": "quest",
        "flag": "Diving Bell Pt3 Descend",
        "icon": "assets/quest/Fall_Quest_Icon.png",
        "description": "Use the diving bell in Deep Docks to descend beneath Pharloom.",
        "link": "https://hollowknight.wiki/w/Acts#Act_3:_Abyss"
      },
      {
        "id": "the-dark-below-4",
        "label": "The Dark Below #4",
        "type": "quest",
        "flag": "Black Thread Pt2 Abyss",
        "icon": "assets/quest/Fall_Quest_Icon.png",
        "description": "Reach the source of the black threads within the Abyss.",
        "link": "https://hollowknight.wiki/w/Acts#Act_3:_Abyss"
      },
      {
        "id": "return-to-pharloom",
        "label": "Return to Pharloom",
        "type": "quest",
        "flag": "Black Thread Pt3 Escape",
        "icon": "assets/quest/Fall_Quest_Icon.png",
        "description": "Escape the Abyss.",
        "link": "https://hollowknight.wiki/w/Acts#Act_3:_Abyss"
      },
      {
        "id": "spell-seeker",
        "label": "Spell Seeker",
        "type": "quest",
        "flag": "Black Thread Pt4 Return",
        "icon": "assets/quest/Fall_Quest_Icon.png",
        "description": "Return to the Snail Shamans in the Ruined Chapel beside Bone Bottom.",
        "link": "https://hollowknight.wiki/w/Acts#Act_3:_Abyss"
      },
      {
        "id": "the-old-hearts",
        "label": "The Old Hearts",
        "type": "quest",
        "flag": "Black Thread Pt5 Heart",
        "icon": "assets/quest/Fall_Quest_Icon.png",
        "description": "Enliven and acquire the old hearts of Pharloom.",
        "link": "https://hollowknight.wiki/w/Acts#Act_3:_Abyss"
      },
      {
        "id": "last-dive",
        "label": "Last Dive",
        "category": "Boss",
        "flag": "Lost Lace",
        "type": "journal",
        "subtype": "kills",
        "required": 1,
        "icon": "assets/quest/Finale_Quest_Icon.png",
        "description": "Dive into the Void and cut Pharloom free.",
        "link": "https://hollowknight.wiki/w/Acts#Act_3:_Abyss"
      }
    ]
  },
  {
    "id": "wayfarer-quests",
    "label": "Wayfarer Wishes",
    "desc": "Wayfarer Wishes usually involve finding an item or NPC during Hornet's exploration of Pharloom at the request of another NPC. Later in the game, some Wayfarer Wishes will be placed that involve defeating optional bosses.",
    "contrib": 0,
    "items": [
      {
        "id": "lost-fleas-1",
        "label": "The Lost Fleas #1",
        "type": "quest",
        "flag": "Save the Fleas Pre",
        "icon": "assets/quest/wayfarer.png",
        "description": "Speak to the fleas before starting their rescue.",
        "link": "https://hollowknight.wiki/w/Category:Wishes#Wayfarer_Wishes"
      },
      {
        "id": "lost-fleas-2",
        "label": "The Lost Fleas #2",
        "type": "quest",
        "flag": "Save the Fleas",
        "icon": "assets/quest/wayfarer.png",
        "description": "Find and save the 5 lost fleas.",
        "link": "https://hollowknight.wiki/w/Category:Wishes#Wayfarer_Wishes"
      },
      {
        "id": "pinmasters-oil",
        "label": "Pinmaster's Oil",
        "type": "quest",
        "flag": "A Pinsmiths Tools",
        "icon": "assets/quest/wayfarer.png",
        "description": "Retrieve pale oil from the Citadel.",
        "link": "https://hollowknight.wiki/w/Category:Wishes#Wayfarer_Wishes",
        "missable": true
      },
      {
        "id": "my-missing-courier",
        "label": "My Missing Courier",
        "type": "quest",
        "flag": "Save Courier Short",
        "icon": "assets/quest/wayfarer.png",
        "description": "Search for traces of the courier Tipp and track his location.",
        "link": "https://hollowknight.wiki/w/Category:Wishes#Wayfarer_Wishes"
      },
      {
        "id": "my-missing-brother",
        "label": "My Missing Brother",
        "type": "quest",
        "flag": "Save Courier Tall",
        "icon": "assets/quest/wayfarer.png",
        "description": "Search for traces of the courier Pill and track his location.",
        "link": "https://hollowknight.wiki/w/Category:Wishes#Wayfarer_Wishes"
      },
      {
        "id": "balm-for-the-wounded",
        "label": "Balm for the Wounded",
        "type": "quest",
        "flag": "Save Sherma",